run_id,run_ts,dataset_name,table_name,check_name,dimension,issue_type,severity,affected_rows,affected_pct,sample_bad_rows_json,probable_root_cause,recommended_fix,root_cause_candidates
7df76f5d-2dfd-5544-b418-e87f8a3fef86,2026-05-06T06:30:57.415106+00:00,phase1,users,users_email_not_null,completeness,missing,3,1,0.125,"[{""user_id"": ""566c5272-615e-5dc5-9a68-8224491c3365"", ""email"": null, ""org_id"": ""36aca3ae-698e-57c6-b10c-b66479c07101"", ""role"": ""student"", ""state"": ""CA"", ""district_id"": ""04ef9c63-8e07-5a9c-9a19-ca6f5d2bbca8""}]",CRM export allows blank email when contact is incomplete,Add validation on source and require email before export,"[{""probable_cause"": ""CRM export allows blank email when contact is incomplete"", ""recommended_fix"": ""Add validation on source and require email before export""}]"
7df76f5d-2dfd-5544-b418-e87f8a3fef86,2026-05-06T06:30:57.415106+00:00,phase1,users,users_district_id_not_null,completeness,missing,2,1,0.125,"[{""user_id"": ""e5d4f387-0c24-543e-b029-e15114d2c4d8"", ""email"": ""eve.lem@example.com"", ""org_id"": ""e04ea6db-c30b-5dc3-95cb-8706a074c98b"", ""role"": ""other"", ""state"": ""CA"", ""district_id"": null}]",Upstream export omitted district join,Add district_id to export template and enforce ingestion join,"[{""probable_cause"": ""Upstream export omitted district join"", ""recommended_fix"": ""Add district_id to export template and enforce ingestion join""}]"
7df76f5d-2dfd-5544-b418-e87f8a3fef86,2026-05-06T06:30:57.415106+00:00,phase1,users,users_email_unique,uniqueness,duplicate,4,1,0.125,"[{""user_id"": ""d5625164-b625-5266-8f2e-a7281d3cc9c1"", ""email"": ""alice.smith@example.com"", ""org_id"": ""48ea6847-c96b-5dc1-af54-3cde27ca582d"", ""role"": ""teacher"", ""state"": ""CA"", ""district_id"": ""04ef9c63-8e07-5a9c-9a19-ca6f5d2bbca8"", ""dq_rank"": ""2""}]",Email should uniquely identify CRM records.,Enforce DUPLICATE_PERCENTAGE for users,[]
7df76f5d-2dfd-5544-b418-e87f8a3fef86,2026-05-06T06:30:57.415106+00:00,phase1,resources,resources_resource_id_unique,uniqueness,duplicate,4,1,0.16666666666666666,"[{""resource_id"": ""a3c2aa6a-669a-58dd-a9e9-c32855e9f0f6"", ""type"": ""lesson"", ""subject"": ""Math"", ""grade_band"": ""PreK-2"", ""dq_rank"": ""2""}]",Resource IDs must stay unique inside the catalog.,Enforce DUPLICATE_PERCENTAGE for resources,[]
7df76f5d-2dfd-5544-b418-e87f8a3fef86,2026-05-06T06:30:57.415106+00:00,phase1,users,users_email_org_unique,uniqueness,duplicate,3,1,0.125,"[{""user_id"": ""d5625164-b625-5266-8f2e-a7281d3cc9c1"", ""email"": ""alice.smith@example.com"", ""org_id"": ""48ea6847-c96b-5dc1-af54-3cde27ca582d"", ""role"": ""teacher"", ""state"": ""CA"", ""district_id"": ""04ef9c63-8e07-5a9c-9a19-ca6f5d2bbca8"", ""dq_rank"": ""2""}]","The (email, org) compound key should dedupe duplicates.",Enforce DUPLICATE_PERCENTAGE for users,[]
