run_id,run_ts,dataset_name,table_name,check_name,dimension,issue_type,severity,affected_rows,affected_pct,sample_bad_rows_json,probable_root_cause,recommended_fix,root_cause_candidates
1e388b20-dece-51d3-a8a3-243e41af42b8,2026-04-12T05:55:11.796928+00:00,phase1,users,users_email_not_null,completeness,missing,3,1,0.125,"[{""user_id"": ""ccdd29cc-4b15-5e86-bb7b-1a8510f5ce7e"", ""email"": null, ""org_id"": ""293149a3-498d-50b5-ab56-33088dccd474"", ""role"": ""student"", ""state"": ""CA"", ""district_id"": ""bd7c8c0e-bb38-5c7e-9db3-c92a78d90efc""}]",CRM export allows blank email when contact is incomplete,Add validation on source and require email before export,"[{""probable_cause"": ""CRM export allows blank email when contact is incomplete"", ""recommended_fix"": ""Add validation on source and require email before export""}]"
1e388b20-dece-51d3-a8a3-243e41af42b8,2026-04-12T05:55:11.796928+00:00,phase1,users,users_district_id_not_null,completeness,missing,2,1,0.125,"[{""user_id"": ""2f1e8379-7db7-5576-ac41-df9ffa2d72fd"", ""email"": ""eve.lem@example.com"", ""org_id"": ""ee0345db-2dc6-5fa7-a143-f14123aa3ea3"", ""role"": ""other"", ""state"": ""CA"", ""district_id"": null}]",Upstream export omitted district join,Add district_id to export template and enforce ingestion join,"[{""probable_cause"": ""Upstream export omitted district join"", ""recommended_fix"": ""Add district_id to export template and enforce ingestion join""}]"
1e388b20-dece-51d3-a8a3-243e41af42b8,2026-04-12T05:55:11.796928+00:00,phase1,users,users_email_unique,uniqueness,duplicate,4,1,0.125,"[{""user_id"": ""e6fe8185-d01e-5ed8-8985-c122f14d91ed"", ""email"": ""alice.smith@example.com"", ""org_id"": ""59edd4e4-e220-5c8f-bf81-750e56a02d25"", ""role"": ""teacher"", ""state"": ""CA"", ""district_id"": ""bd7c8c0e-bb38-5c7e-9db3-c92a78d90efc"", ""dq_rank"": ""2""}]",Email should uniquely identify CRM records.,Enforce DUPLICATE_PERCENTAGE for users,[]
1e388b20-dece-51d3-a8a3-243e41af42b8,2026-04-12T05:55:11.796928+00:00,phase1,resources,resources_resource_id_unique,uniqueness,duplicate,4,1,0.16666666666666666,"[{""resource_id"": ""a5668c26-0a5c-5a91-834a-4c7985de6ab9"", ""type"": ""lesson"", ""subject"": ""Math"", ""grade_band"": ""PreK-2"", ""dq_rank"": ""2""}]",Resource IDs must stay unique inside the catalog.,Enforce DUPLICATE_PERCENTAGE for resources,[]
1e388b20-dece-51d3-a8a3-243e41af42b8,2026-04-12T05:55:11.796928+00:00,phase1,users,users_email_org_unique,uniqueness,duplicate,3,1,0.125,"[{""user_id"": ""e6fe8185-d01e-5ed8-8985-c122f14d91ed"", ""email"": ""alice.smith@example.com"", ""org_id"": ""59edd4e4-e220-5c8f-bf81-750e56a02d25"", ""role"": ""teacher"", ""state"": ""CA"", ""district_id"": ""bd7c8c0e-bb38-5c7e-9db3-c92a78d90efc"", ""dq_rank"": ""2""}]","The (email, org) compound key should dedupe duplicates.",Enforce DUPLICATE_PERCENTAGE for users,[]
