run_id,run_ts,dataset_name,table_name,check_name,dimension,issue_type,severity,affected_rows,affected_pct,sample_bad_rows_json,probable_root_cause,recommended_fix,root_cause_candidates
f8d44371-2f34-57b6-ae7c-190fff0bfd55,2026-03-16T05:50:08.249452+00:00,phase1,users,users_email_not_null,completeness,missing,3,1,0.125,"[{""user_id"": ""78ba78cb-6d6b-524e-b375-7a0129c57de4"", ""email"": null, ""org_id"": ""dacf0ef8-f259-588d-a73d-5b0e3d819015"", ""role"": ""student"", ""state"": ""CA"", ""district_id"": ""82dce7ac-c184-5767-8299-72abc10f96bf""}]",CRM export allows blank email when contact is incomplete,Add validation on source and require email before export,"[{""probable_cause"": ""CRM export allows blank email when contact is incomplete"", ""recommended_fix"": ""Add validation on source and require email before export""}]"
f8d44371-2f34-57b6-ae7c-190fff0bfd55,2026-03-16T05:50:08.249452+00:00,phase1,users,users_district_id_not_null,completeness,missing,2,1,0.125,"[{""user_id"": ""f1ff358d-d074-50d6-be79-aaa567e7d893"", ""email"": ""eve.lem@example.com"", ""org_id"": ""e5e00628-ab09-51cb-97f9-b378d28f557a"", ""role"": ""other"", ""state"": ""CA"", ""district_id"": null}]",Upstream export omitted district join,Add district_id to export template and enforce ingestion join,"[{""probable_cause"": ""Upstream export omitted district join"", ""recommended_fix"": ""Add district_id to export template and enforce ingestion join""}]"
f8d44371-2f34-57b6-ae7c-190fff0bfd55,2026-03-16T05:50:08.249452+00:00,phase1,users,users_email_unique,uniqueness,duplicate,4,1,0.125,"[{""user_id"": ""e7f8d3a2-0d7e-586c-b826-6e1f2d356913"", ""email"": ""alice.smith@example.com"", ""org_id"": ""8c6ec79b-5b50-5085-bc51-4e29a32bb4f4"", ""role"": ""teacher"", ""state"": ""CA"", ""district_id"": ""82dce7ac-c184-5767-8299-72abc10f96bf"", ""dq_rank"": ""2""}]",Email should uniquely identify CRM records.,Enforce DUPLICATE_PERCENTAGE for users,[]
f8d44371-2f34-57b6-ae7c-190fff0bfd55,2026-03-16T05:50:08.249452+00:00,phase1,resources,resources_resource_id_unique,uniqueness,duplicate,4,1,0.16666666666666666,"[{""resource_id"": ""72a110ed-bebf-5666-89c0-e4e4557014c5"", ""type"": ""lesson"", ""subject"": ""math"", ""grade_band"": ""PreK-2"", ""dq_rank"": ""2""}]",Resource IDs must stay unique inside the catalog.,Enforce DUPLICATE_PERCENTAGE for resources,[]
f8d44371-2f34-57b6-ae7c-190fff0bfd55,2026-03-16T05:50:08.249452+00:00,phase1,users,users_email_org_unique,uniqueness,duplicate,3,1,0.125,"[{""user_id"": ""e7f8d3a2-0d7e-586c-b826-6e1f2d356913"", ""email"": ""alice.smith@example.com"", ""org_id"": ""8c6ec79b-5b50-5085-bc51-4e29a32bb4f4"", ""role"": ""teacher"", ""state"": ""CA"", ""district_id"": ""82dce7ac-c184-5767-8299-72abc10f96bf"", ""dq_rank"": ""2""}]","The (email, org) compound key should dedupe duplicates.",Enforce DUPLICATE_PERCENTAGE for users,[]
