run_id,run_ts,dataset_name,table_name,check_name,dimension,issue_type,severity,affected_rows,affected_pct,sample_bad_rows_json,probable_root_cause,recommended_fix,root_cause_candidates
47563c89-3c9b-5d2b-9faf-807173b9cb53,2026-04-06T06:00:29.646136+00:00,phase1,users,users_email_not_null,completeness,missing,3,1,0.125,"[{""user_id"": ""83676358-d06a-5c5c-910a-0b5c137a114c"", ""email"": null, ""org_id"": ""df5302ed-eaff-5adf-ac46-364d43bdcd9d"", ""role"": ""student"", ""state"": ""CA"", ""district_id"": ""ad304d2e-dc78-541a-97f2-0477103a0d5e""}]",CRM export allows blank email when contact is incomplete,Add validation on source and require email before export,"[{""probable_cause"": ""CRM export allows blank email when contact is incomplete"", ""recommended_fix"": ""Add validation on source and require email before export""}]"
47563c89-3c9b-5d2b-9faf-807173b9cb53,2026-04-06T06:00:29.646136+00:00,phase1,users,users_district_id_not_null,completeness,missing,2,1,0.125,"[{""user_id"": ""5faabe02-d41f-50f2-b9f6-bea34bf6e80c"", ""email"": ""eve.lem@example.com"", ""org_id"": ""5abf5ba2-bb71-5517-a077-dd2f4fd98a89"", ""role"": ""other"", ""state"": ""CA"", ""district_id"": null}]",Upstream export omitted district join,Add district_id to export template and enforce ingestion join,"[{""probable_cause"": ""Upstream export omitted district join"", ""recommended_fix"": ""Add district_id to export template and enforce ingestion join""}]"
47563c89-3c9b-5d2b-9faf-807173b9cb53,2026-04-06T06:00:29.646136+00:00,phase1,users,users_email_unique,uniqueness,duplicate,4,1,0.125,"[{""user_id"": ""b4f7e1a2-cb48-5ecf-9078-27878dfbcc27"", ""email"": ""alice.smith@example.com"", ""org_id"": ""c13cc8b7-8216-5466-ab04-e528e3c8e6a9"", ""role"": ""teacher"", ""state"": ""CA"", ""district_id"": ""ad304d2e-dc78-541a-97f2-0477103a0d5e"", ""dq_rank"": ""2""}]",Email should uniquely identify CRM records.,Enforce DUPLICATE_PERCENTAGE for users,[]
47563c89-3c9b-5d2b-9faf-807173b9cb53,2026-04-06T06:00:29.646136+00:00,phase1,resources,resources_resource_id_unique,uniqueness,duplicate,4,1,0.16666666666666666,"[{""resource_id"": ""da5eb17a-4959-5792-83c8-9a754e630c22"", ""type"": ""lesson"", ""subject"": ""math"", ""grade_band"": ""PreK-2"", ""dq_rank"": ""2""}]",Resource IDs must stay unique inside the catalog.,Enforce DUPLICATE_PERCENTAGE for resources,[]
47563c89-3c9b-5d2b-9faf-807173b9cb53,2026-04-06T06:00:29.646136+00:00,phase1,users,users_email_org_unique,uniqueness,duplicate,3,1,0.125,"[{""user_id"": ""b4f7e1a2-cb48-5ecf-9078-27878dfbcc27"", ""email"": ""alice.smith@example.com"", ""org_id"": ""c13cc8b7-8216-5466-ab04-e528e3c8e6a9"", ""role"": ""teacher"", ""state"": ""CA"", ""district_id"": ""ad304d2e-dc78-541a-97f2-0477103a0d5e"", ""dq_rank"": ""2""}]","The (email, org) compound key should dedupe duplicates.",Enforce DUPLICATE_PERCENTAGE for users,[]
