run_id,run_ts,dataset_name,table_name,check_name,dimension,issue_type,severity,affected_rows,affected_pct,sample_bad_rows_json,probable_root_cause,recommended_fix,root_cause_candidates
c79fd65a-b919-5a8f-9d8f-09bc057e4450,2026-05-04T17:29:42.283886+00:00,phase1,users,users_email_not_null,completeness,missing,3,1,0.125,"[{""user_id"": ""ce007dda-fc9a-544d-bc92-00045ad8a709"", ""email"": null, ""org_id"": ""fefd8b64-d726-5da6-a0c4-941aef8f0d6c"", ""role"": ""student"", ""state"": ""CA"", ""district_id"": ""f6d087ad-4c32-577e-a029-2b62caebc6ac""}]",CRM export allows blank email when contact is incomplete,Add validation on source and require email before export,"[{""probable_cause"": ""CRM export allows blank email when contact is incomplete"", ""recommended_fix"": ""Add validation on source and require email before export""}]"
c79fd65a-b919-5a8f-9d8f-09bc057e4450,2026-05-04T17:29:42.283886+00:00,phase1,users,users_district_id_not_null,completeness,missing,2,1,0.125,"[{""user_id"": ""c589996d-3b9d-5715-9853-efbc4f0df2e9"", ""email"": ""eve.lem@example.com"", ""org_id"": ""a4ef755e-1fbe-52fb-b45e-b550d2cd4b51"", ""role"": ""other"", ""state"": ""CA"", ""district_id"": null}]",Upstream export omitted district join,Add district_id to export template and enforce ingestion join,"[{""probable_cause"": ""Upstream export omitted district join"", ""recommended_fix"": ""Add district_id to export template and enforce ingestion join""}]"
c79fd65a-b919-5a8f-9d8f-09bc057e4450,2026-05-04T17:29:42.283886+00:00,phase1,users,users_email_unique,uniqueness,duplicate,4,1,0.125,"[{""user_id"": ""28d0eca1-09e9-5b33-88a9-fdbf5913e26b"", ""email"": ""alice.smith@example.com"", ""org_id"": ""4bf55d99-f1ee-54a0-b946-2aa79a2f51a2"", ""role"": ""teacher"", ""state"": ""CA"", ""district_id"": ""f6d087ad-4c32-577e-a029-2b62caebc6ac"", ""dq_rank"": ""2""}]",Email should uniquely identify CRM records.,Enforce DUPLICATE_PERCENTAGE for users,[]
c79fd65a-b919-5a8f-9d8f-09bc057e4450,2026-05-04T17:29:42.283886+00:00,phase1,resources,resources_resource_id_unique,uniqueness,duplicate,4,1,0.16666666666666666,"[{""resource_id"": ""42845cfa-da3b-5621-b180-62df4baeea70"", ""type"": ""lesson"", ""subject"": ""Math"", ""grade_band"": ""PreK-2"", ""dq_rank"": ""2""}]",Resource IDs must stay unique inside the catalog.,Enforce DUPLICATE_PERCENTAGE for resources,[]
c79fd65a-b919-5a8f-9d8f-09bc057e4450,2026-05-04T17:29:42.283886+00:00,phase1,users,users_email_org_unique,uniqueness,duplicate,3,1,0.125,"[{""user_id"": ""28d0eca1-09e9-5b33-88a9-fdbf5913e26b"", ""email"": ""alice.smith@example.com"", ""org_id"": ""4bf55d99-f1ee-54a0-b946-2aa79a2f51a2"", ""role"": ""teacher"", ""state"": ""CA"", ""district_id"": ""f6d087ad-4c32-577e-a029-2b62caebc6ac"", ""dq_rank"": ""2""}]","The (email, org) compound key should dedupe duplicates.",Enforce DUPLICATE_PERCENTAGE for users,[]
