run_id,run_ts,dataset_name,table_name,check_name,dimension,issue_type,severity,affected_rows,affected_pct,sample_bad_rows_json,probable_root_cause,recommended_fix,root_cause_candidates
9d8d23f8-103d-5ab9-b156-fa74925d717e,2026-05-02T06:08:44.364682+00:00,phase1,users,users_email_not_null,completeness,missing,3,1,0.125,"[{""user_id"": ""677e143d-3408-5c44-9d6f-802cf4191349"", ""email"": null, ""org_id"": ""432e04db-c88c-55e9-9ef1-0739c75c5aaa"", ""role"": ""student"", ""state"": ""CA"", ""district_id"": ""4426f8ef-9870-5914-81a8-40059291ddd1""}]",CRM export allows blank email when contact is incomplete,Add validation on source and require email before export,"[{""probable_cause"": ""CRM export allows blank email when contact is incomplete"", ""recommended_fix"": ""Add validation on source and require email before export""}]"
9d8d23f8-103d-5ab9-b156-fa74925d717e,2026-05-02T06:08:44.364682+00:00,phase1,users,users_district_id_not_null,completeness,missing,2,1,0.125,"[{""user_id"": ""d5b441ec-c172-5755-90b8-37efc5cffdaa"", ""email"": ""eve.lem@example.com"", ""org_id"": ""749fa457-0ce8-5806-a778-5b9e72f1e2ec"", ""role"": ""other"", ""state"": ""CA"", ""district_id"": null}]",Upstream export omitted district join,Add district_id to export template and enforce ingestion join,"[{""probable_cause"": ""Upstream export omitted district join"", ""recommended_fix"": ""Add district_id to export template and enforce ingestion join""}]"
9d8d23f8-103d-5ab9-b156-fa74925d717e,2026-05-02T06:08:44.364682+00:00,phase1,users,users_email_unique,uniqueness,duplicate,4,1,0.125,"[{""user_id"": ""283deb85-7bf4-59fe-a85c-83353750d744"", ""email"": ""alice.smith@example.com"", ""org_id"": ""a05b89ad-c3f7-5d7d-8311-08b787e3f759"", ""role"": ""teacher"", ""state"": ""CA"", ""district_id"": ""4426f8ef-9870-5914-81a8-40059291ddd1"", ""dq_rank"": ""2""}]",Email should uniquely identify CRM records.,Enforce DUPLICATE_PERCENTAGE for users,[]
9d8d23f8-103d-5ab9-b156-fa74925d717e,2026-05-02T06:08:44.364682+00:00,phase1,resources,resources_resource_id_unique,uniqueness,duplicate,4,1,0.16666666666666666,"[{""resource_id"": ""01d10b72-9f19-596a-94ec-68f939d7096b"", ""type"": ""lesson"", ""subject"": ""math"", ""grade_band"": ""PreK-2"", ""dq_rank"": ""2""}]",Resource IDs must stay unique inside the catalog.,Enforce DUPLICATE_PERCENTAGE for resources,[]
9d8d23f8-103d-5ab9-b156-fa74925d717e,2026-05-02T06:08:44.364682+00:00,phase1,users,users_email_org_unique,uniqueness,duplicate,3,1,0.125,"[{""user_id"": ""283deb85-7bf4-59fe-a85c-83353750d744"", ""email"": ""alice.smith@example.com"", ""org_id"": ""a05b89ad-c3f7-5d7d-8311-08b787e3f759"", ""role"": ""teacher"", ""state"": ""CA"", ""district_id"": ""4426f8ef-9870-5914-81a8-40059291ddd1"", ""dq_rank"": ""2""}]","The (email, org) compound key should dedupe duplicates.",Enforce DUPLICATE_PERCENTAGE for users,[]
