run_id,run_ts,dataset_name,table_name,check_name,dimension,issue_type,severity,affected_rows,affected_pct,sample_bad_rows_json,probable_root_cause,recommended_fix,root_cause_candidates
f6b46fd4-e455-5870-b832-5aa432cb42be,2026-05-04T17:27:46.216856+00:00,phase1,users,users_email_not_null,completeness,missing,3,1,0.125,"[{""user_id"": ""1a86b174-14ff-5a1b-a8e0-e452c9d89af7"", ""email"": null, ""org_id"": ""99fed2a3-bd8e-5881-a8ea-93714f9b62a7"", ""role"": ""student"", ""state"": ""CA"", ""district_id"": ""aeda9bf3-8d0d-503e-94e1-e8af2603b68b""}]",CRM export allows blank email when contact is incomplete,Add validation on source and require email before export,"[{""probable_cause"": ""CRM export allows blank email when contact is incomplete"", ""recommended_fix"": ""Add validation on source and require email before export""}]"
f6b46fd4-e455-5870-b832-5aa432cb42be,2026-05-04T17:27:46.216856+00:00,phase1,users,users_district_id_not_null,completeness,missing,2,1,0.125,"[{""user_id"": ""2106deee-04e1-5602-acd9-c998a94b8dc0"", ""email"": ""eve.lem@example.com"", ""org_id"": ""d538d273-ec48-5409-8d7d-a65bf26de3a3"", ""role"": ""other"", ""state"": ""CA"", ""district_id"": null}]",Upstream export omitted district join,Add district_id to export template and enforce ingestion join,"[{""probable_cause"": ""Upstream export omitted district join"", ""recommended_fix"": ""Add district_id to export template and enforce ingestion join""}]"
f6b46fd4-e455-5870-b832-5aa432cb42be,2026-05-04T17:27:46.216856+00:00,phase1,users,users_email_unique,uniqueness,duplicate,4,1,0.125,"[{""user_id"": ""58c1dac9-24e9-5ab1-a0e2-79a14e718824"", ""email"": ""alice.smith@example.com"", ""org_id"": ""86aec430-c8d6-5262-9837-eb06e5ebc248"", ""role"": ""teacher"", ""state"": ""CA"", ""district_id"": ""aeda9bf3-8d0d-503e-94e1-e8af2603b68b"", ""dq_rank"": ""2""}]",Email should uniquely identify CRM records.,Enforce DUPLICATE_PERCENTAGE for users,[]
f6b46fd4-e455-5870-b832-5aa432cb42be,2026-05-04T17:27:46.216856+00:00,phase1,resources,resources_resource_id_unique,uniqueness,duplicate,4,1,0.16666666666666666,"[{""resource_id"": ""6b89a949-a9dc-5559-8d1e-672a61e215ea"", ""type"": ""lesson"", ""subject"": ""Math"", ""grade_band"": ""PreK-2"", ""dq_rank"": ""2""}]",Resource IDs must stay unique inside the catalog.,Enforce DUPLICATE_PERCENTAGE for resources,[]
f6b46fd4-e455-5870-b832-5aa432cb42be,2026-05-04T17:27:46.216856+00:00,phase1,users,users_email_org_unique,uniqueness,duplicate,3,1,0.125,"[{""user_id"": ""58c1dac9-24e9-5ab1-a0e2-79a14e718824"", ""email"": ""alice.smith@example.com"", ""org_id"": ""86aec430-c8d6-5262-9837-eb06e5ebc248"", ""role"": ""teacher"", ""state"": ""CA"", ""district_id"": ""aeda9bf3-8d0d-503e-94e1-e8af2603b68b"", ""dq_rank"": ""2""}]","The (email, org) compound key should dedupe duplicates.",Enforce DUPLICATE_PERCENTAGE for users,[]
