run_id,run_ts,dataset_name,table_name,check_name,dimension,issue_type,severity,affected_rows,affected_pct,sample_bad_rows_json,probable_root_cause,recommended_fix,root_cause_candidates
35282b9f-26fa-52f4-a1bb-19aada198198,2026-04-16T06:03:39.756345+00:00,phase1,users,users_email_not_null,completeness,missing,3,1,0.125,"[{""user_id"": ""a9e4c083-1f8d-55bc-abc7-fca8edbba7ef"", ""email"": null, ""org_id"": ""d651f1a4-6851-5336-bbb6-898a2cd3dd95"", ""role"": ""student"", ""state"": ""CA"", ""district_id"": ""3a2858bc-b356-5408-9032-b658af37443f""}]",CRM export allows blank email when contact is incomplete,Add validation on source and require email before export,"[{""probable_cause"": ""CRM export allows blank email when contact is incomplete"", ""recommended_fix"": ""Add validation on source and require email before export""}]"
35282b9f-26fa-52f4-a1bb-19aada198198,2026-04-16T06:03:39.756345+00:00,phase1,users,users_district_id_not_null,completeness,missing,2,1,0.125,"[{""user_id"": ""1390140e-b741-5dca-942b-6f15a5e1bcb9"", ""email"": ""eve.lem@example.com"", ""org_id"": ""a9a9312a-546a-5ae1-9357-431edb0ae770"", ""role"": ""other"", ""state"": ""CA"", ""district_id"": null}]",Upstream export omitted district join,Add district_id to export template and enforce ingestion join,"[{""probable_cause"": ""Upstream export omitted district join"", ""recommended_fix"": ""Add district_id to export template and enforce ingestion join""}]"
35282b9f-26fa-52f4-a1bb-19aada198198,2026-04-16T06:03:39.756345+00:00,phase1,users,users_email_unique,uniqueness,duplicate,4,1,0.125,"[{""user_id"": ""fd75f8e7-9708-5f92-8322-5fe2b9a05ab9"", ""email"": ""alice.smith@example.com"", ""org_id"": ""104e603c-1cb4-59a5-a629-12773626680f"", ""role"": ""teacher"", ""state"": ""CA"", ""district_id"": ""3a2858bc-b356-5408-9032-b658af37443f"", ""dq_rank"": ""2""}]",Email should uniquely identify CRM records.,Enforce DUPLICATE_PERCENTAGE for users,[]
35282b9f-26fa-52f4-a1bb-19aada198198,2026-04-16T06:03:39.756345+00:00,phase1,resources,resources_resource_id_unique,uniqueness,duplicate,4,1,0.16666666666666666,"[{""resource_id"": ""e1ab7679-5a58-5479-a203-691e4b48c50b"", ""type"": ""lesson"", ""subject"": ""Math"", ""grade_band"": ""PreK-2"", ""dq_rank"": ""2""}]",Resource IDs must stay unique inside the catalog.,Enforce DUPLICATE_PERCENTAGE for resources,[]
35282b9f-26fa-52f4-a1bb-19aada198198,2026-04-16T06:03:39.756345+00:00,phase1,users,users_email_org_unique,uniqueness,duplicate,3,1,0.125,"[{""user_id"": ""fd75f8e7-9708-5f92-8322-5fe2b9a05ab9"", ""email"": ""alice.smith@example.com"", ""org_id"": ""104e603c-1cb4-59a5-a629-12773626680f"", ""role"": ""teacher"", ""state"": ""CA"", ""district_id"": ""3a2858bc-b356-5408-9032-b658af37443f"", ""dq_rank"": ""2""}]","The (email, org) compound key should dedupe duplicates.",Enforce DUPLICATE_PERCENTAGE for users,[]
