run_id,run_ts,dataset_name,table_name,check_name,dimension,issue_type,severity,affected_rows,affected_pct,sample_bad_rows_json,probable_root_cause,recommended_fix,root_cause_candidates
f686d21c-3235-539b-b1cc-f5fff084dd4f,2026-05-04T17:29:00.230250+00:00,phase1,users,users_email_not_null,completeness,missing,3,1,0.125,"[{""user_id"": ""b4020395-9507-524d-9ad6-e66c17c59574"", ""email"": null, ""org_id"": ""1356bfb9-5525-5cdc-b840-fa57937ecd82"", ""role"": ""student"", ""state"": ""CA"", ""district_id"": ""d6e330ea-0615-58e4-bdcf-33ae73bfbe84""}]",CRM export allows blank email when contact is incomplete,Add validation on source and require email before export,"[{""probable_cause"": ""CRM export allows blank email when contact is incomplete"", ""recommended_fix"": ""Add validation on source and require email before export""}]"
f686d21c-3235-539b-b1cc-f5fff084dd4f,2026-05-04T17:29:00.230250+00:00,phase1,users,users_district_id_not_null,completeness,missing,2,1,0.125,"[{""user_id"": ""95e5da22-ec93-503e-8405-d7fdd3cbc03c"", ""email"": ""eve.lem@example.com"", ""org_id"": ""9de8bf85-55c9-5e4c-87e4-3b1698499861"", ""role"": ""other"", ""state"": ""CA"", ""district_id"": null}]",Upstream export omitted district join,Add district_id to export template and enforce ingestion join,"[{""probable_cause"": ""Upstream export omitted district join"", ""recommended_fix"": ""Add district_id to export template and enforce ingestion join""}]"
f686d21c-3235-539b-b1cc-f5fff084dd4f,2026-05-04T17:29:00.230250+00:00,phase1,users,users_email_unique,uniqueness,duplicate,4,1,0.125,"[{""user_id"": ""ca95390e-640a-538c-b3b9-f1e81acd0027"", ""email"": ""alice.smith@example.com"", ""org_id"": ""91b583ce-94d9-5c0b-96ac-dcec924cdeee"", ""role"": ""teacher"", ""state"": ""CA"", ""district_id"": ""d6e330ea-0615-58e4-bdcf-33ae73bfbe84"", ""dq_rank"": ""2""}]",Email should uniquely identify CRM records.,Enforce DUPLICATE_PERCENTAGE for users,[]
f686d21c-3235-539b-b1cc-f5fff084dd4f,2026-05-04T17:29:00.230250+00:00,phase1,resources,resources_resource_id_unique,uniqueness,duplicate,4,1,0.16666666666666666,"[{""resource_id"": ""373a7a56-3f16-58f1-9e5b-0cd99b2da2d8"", ""type"": ""lesson"", ""subject"": ""Math"", ""grade_band"": ""PreK-2"", ""dq_rank"": ""2""}]",Resource IDs must stay unique inside the catalog.,Enforce DUPLICATE_PERCENTAGE for resources,[]
f686d21c-3235-539b-b1cc-f5fff084dd4f,2026-05-04T17:29:00.230250+00:00,phase1,users,users_email_org_unique,uniqueness,duplicate,3,1,0.125,"[{""user_id"": ""ca95390e-640a-538c-b3b9-f1e81acd0027"", ""email"": ""alice.smith@example.com"", ""org_id"": ""91b583ce-94d9-5c0b-96ac-dcec924cdeee"", ""role"": ""teacher"", ""state"": ""CA"", ""district_id"": ""d6e330ea-0615-58e4-bdcf-33ae73bfbe84"", ""dq_rank"": ""2""}]","The (email, org) compound key should dedupe duplicates.",Enforce DUPLICATE_PERCENTAGE for users,[]
