run_id,run_ts,dataset_name,table_name,check_name,dimension,issue_type,severity,affected_rows,affected_pct,sample_bad_rows_json,probable_root_cause,recommended_fix,root_cause_candidates
196b6365-b5a9-5ff0-91d2-b6151d01c36b,2026-04-09T05:50:06.723999+00:00,phase1,users,users_email_not_null,completeness,missing,3,1,0.125,"[{""user_id"": ""e5fb2c4d-622a-544c-9854-1435357549c0"", ""email"": null, ""org_id"": ""bb1bda31-ce40-5a03-810a-66124b3c1ee6"", ""role"": ""student"", ""state"": ""CA"", ""district_id"": ""87f42c05-aad6-5ac5-a68a-0e809f73abc2""}]",CRM export allows blank email when contact is incomplete,Add validation on source and require email before export,"[{""probable_cause"": ""CRM export allows blank email when contact is incomplete"", ""recommended_fix"": ""Add validation on source and require email before export""}]"
196b6365-b5a9-5ff0-91d2-b6151d01c36b,2026-04-09T05:50:06.723999+00:00,phase1,users,users_district_id_not_null,completeness,missing,2,1,0.125,"[{""user_id"": ""4d6c20f5-acc1-5cf3-b7d2-a726c0211fe4"", ""email"": ""eve.lem@example.com"", ""org_id"": ""130bd0d4-e861-5da2-b911-871c9a931b89"", ""role"": ""other"", ""state"": ""CA"", ""district_id"": null}]",Upstream export omitted district join,Add district_id to export template and enforce ingestion join,"[{""probable_cause"": ""Upstream export omitted district join"", ""recommended_fix"": ""Add district_id to export template and enforce ingestion join""}]"
196b6365-b5a9-5ff0-91d2-b6151d01c36b,2026-04-09T05:50:06.723999+00:00,phase1,users,users_email_unique,uniqueness,duplicate,4,1,0.125,"[{""user_id"": ""0026def9-a045-5a61-bf8b-571aa143990b"", ""email"": ""alice.smith@example.com"", ""org_id"": ""a699ad64-bde7-593f-8104-f42811affb9e"", ""role"": ""teacher"", ""state"": ""CA"", ""district_id"": ""87f42c05-aad6-5ac5-a68a-0e809f73abc2"", ""dq_rank"": ""2""}]",Email should uniquely identify CRM records.,Enforce DUPLICATE_PERCENTAGE for users,[]
196b6365-b5a9-5ff0-91d2-b6151d01c36b,2026-04-09T05:50:06.723999+00:00,phase1,resources,resources_resource_id_unique,uniqueness,duplicate,4,1,0.16666666666666666,"[{""resource_id"": ""3a29f8c0-03a8-506e-b311-79e0f60feb92"", ""type"": ""lesson"", ""subject"": ""Math"", ""grade_band"": ""PreK-2"", ""dq_rank"": ""2""}]",Resource IDs must stay unique inside the catalog.,Enforce DUPLICATE_PERCENTAGE for resources,[]
196b6365-b5a9-5ff0-91d2-b6151d01c36b,2026-04-09T05:50:06.723999+00:00,phase1,users,users_email_org_unique,uniqueness,duplicate,3,1,0.125,"[{""user_id"": ""0026def9-a045-5a61-bf8b-571aa143990b"", ""email"": ""alice.smith@example.com"", ""org_id"": ""a699ad64-bde7-593f-8104-f42811affb9e"", ""role"": ""teacher"", ""state"": ""CA"", ""district_id"": ""87f42c05-aad6-5ac5-a68a-0e809f73abc2"", ""dq_rank"": ""2""}]","The (email, org) compound key should dedupe duplicates.",Enforce DUPLICATE_PERCENTAGE for users,[]
