run_id,run_ts,dataset_name,table_name,check_name,dimension,issue_type,severity,affected_rows,affected_pct,sample_bad_rows_json,probable_root_cause,recommended_fix,root_cause_candidates
eb2628f4-35c6-5e4c-8bc4-5e881f02bf0a,2026-03-21T05:07:39.484221+00:00,phase1,users,users_email_not_null,completeness,missing,3,1,0.125,"[{""user_id"": ""b4a71e60-f5d0-5ddb-98fa-03b535e65047"", ""email"": null, ""org_id"": ""50ab28a7-7eb7-5dda-9358-5cabce0b27af"", ""role"": ""student"", ""state"": ""CA"", ""district_id"": ""dc06dfd4-7990-54bc-82bc-6224936ce729""}]",CRM export allows blank email when contact is incomplete,Add validation on source and require email before export,"[{""probable_cause"": ""CRM export allows blank email when contact is incomplete"", ""recommended_fix"": ""Add validation on source and require email before export""}]"
eb2628f4-35c6-5e4c-8bc4-5e881f02bf0a,2026-03-21T05:07:39.484221+00:00,phase1,users,users_district_id_not_null,completeness,missing,2,1,0.125,"[{""user_id"": ""1d08a5e2-a011-5adb-9199-3c959d8adb66"", ""email"": ""eve.lem@example.com"", ""org_id"": ""a0d40a53-f6a7-5c0b-9e11-724a8c5b3df5"", ""role"": ""other"", ""state"": ""CA"", ""district_id"": null}]",Upstream export omitted district join,Add district_id to export template and enforce ingestion join,"[{""probable_cause"": ""Upstream export omitted district join"", ""recommended_fix"": ""Add district_id to export template and enforce ingestion join""}]"
eb2628f4-35c6-5e4c-8bc4-5e881f02bf0a,2026-03-21T05:07:39.484221+00:00,phase1,users,users_email_unique,uniqueness,duplicate,4,1,0.125,"[{""user_id"": ""d5a1d960-78b1-5c47-a3f3-53dfa0f84861"", ""email"": ""alice.smith@example.com"", ""org_id"": ""ac55f528-a1af-5f10-8dbe-162808414439"", ""role"": ""teacher"", ""state"": ""CA"", ""district_id"": ""dc06dfd4-7990-54bc-82bc-6224936ce729"", ""dq_rank"": ""2""}]",Email should uniquely identify CRM records.,Enforce DUPLICATE_PERCENTAGE for users,[]
eb2628f4-35c6-5e4c-8bc4-5e881f02bf0a,2026-03-21T05:07:39.484221+00:00,phase1,resources,resources_resource_id_unique,uniqueness,duplicate,4,1,0.16666666666666666,"[{""resource_id"": ""ca797fdf-bf7e-5603-a6ad-7af24c6c90b4"", ""type"": ""lesson"", ""subject"": ""Math"", ""grade_band"": ""PreK-2"", ""dq_rank"": ""2""}]",Resource IDs must stay unique inside the catalog.,Enforce DUPLICATE_PERCENTAGE for resources,[]
eb2628f4-35c6-5e4c-8bc4-5e881f02bf0a,2026-03-21T05:07:39.484221+00:00,phase1,users,users_email_org_unique,uniqueness,duplicate,3,1,0.125,"[{""user_id"": ""d5a1d960-78b1-5c47-a3f3-53dfa0f84861"", ""email"": ""alice.smith@example.com"", ""org_id"": ""ac55f528-a1af-5f10-8dbe-162808414439"", ""role"": ""teacher"", ""state"": ""CA"", ""district_id"": ""dc06dfd4-7990-54bc-82bc-6224936ce729"", ""dq_rank"": ""2""}]","The (email, org) compound key should dedupe duplicates.",Enforce DUPLICATE_PERCENTAGE for users,[]
