run_id,run_ts,dataset_name,table_name,check_name,dimension,issue_type,severity,affected_rows,affected_pct,sample_bad_rows_json,probable_root_cause,recommended_fix,root_cause_candidates
5bb87501-6dbe-584f-8fd3-5b633c81531a,2026-04-30T06:29:02.558212+00:00,phase1,users,users_email_not_null,completeness,missing,3,1,0.125,"[{""user_id"": ""c3834b98-5916-5fcc-b273-311d8e4dc3b7"", ""email"": null, ""org_id"": ""8f5ba454-ec57-567c-b797-a0bfea78c8d2"", ""role"": ""student"", ""state"": ""CA"", ""district_id"": ""b4487d47-fe2e-5dfa-aac9-c99e4763b96f""}]",CRM export allows blank email when contact is incomplete,Add validation on source and require email before export,"[{""probable_cause"": ""CRM export allows blank email when contact is incomplete"", ""recommended_fix"": ""Add validation on source and require email before export""}]"
5bb87501-6dbe-584f-8fd3-5b633c81531a,2026-04-30T06:29:02.558212+00:00,phase1,users,users_district_id_not_null,completeness,missing,2,1,0.125,"[{""user_id"": ""aa62d9f3-ca34-513c-b132-a32cb6689b5f"", ""email"": ""eve.lem@example.com"", ""org_id"": ""1f4a800a-b490-5c89-a112-8a63fd5ec152"", ""role"": ""other"", ""state"": ""CA"", ""district_id"": null}]",Upstream export omitted district join,Add district_id to export template and enforce ingestion join,"[{""probable_cause"": ""Upstream export omitted district join"", ""recommended_fix"": ""Add district_id to export template and enforce ingestion join""}]"
5bb87501-6dbe-584f-8fd3-5b633c81531a,2026-04-30T06:29:02.558212+00:00,phase1,users,users_email_unique,uniqueness,duplicate,4,1,0.125,"[{""user_id"": ""e7270dbc-5607-505f-901a-c66fcd8c6897"", ""email"": ""alice.smith@example.com"", ""org_id"": ""4cd5c316-67a3-54a3-89cf-8bd5dfa3a3c7"", ""role"": ""teacher"", ""state"": ""CA"", ""district_id"": ""b4487d47-fe2e-5dfa-aac9-c99e4763b96f"", ""dq_rank"": ""2""}]",Email should uniquely identify CRM records.,Enforce DUPLICATE_PERCENTAGE for users,[]
5bb87501-6dbe-584f-8fd3-5b633c81531a,2026-04-30T06:29:02.558212+00:00,phase1,resources,resources_resource_id_unique,uniqueness,duplicate,4,1,0.16666666666666666,"[{""resource_id"": ""cad7175a-9b0a-5d62-af65-52a17c474f42"", ""type"": ""lesson"", ""subject"": ""math"", ""grade_band"": ""PreK-2"", ""dq_rank"": ""2""}]",Resource IDs must stay unique inside the catalog.,Enforce DUPLICATE_PERCENTAGE for resources,[]
5bb87501-6dbe-584f-8fd3-5b633c81531a,2026-04-30T06:29:02.558212+00:00,phase1,users,users_email_org_unique,uniqueness,duplicate,3,1,0.125,"[{""user_id"": ""e7270dbc-5607-505f-901a-c66fcd8c6897"", ""email"": ""alice.smith@example.com"", ""org_id"": ""4cd5c316-67a3-54a3-89cf-8bd5dfa3a3c7"", ""role"": ""teacher"", ""state"": ""CA"", ""district_id"": ""b4487d47-fe2e-5dfa-aac9-c99e4763b96f"", ""dq_rank"": ""2""}]","The (email, org) compound key should dedupe duplicates.",Enforce DUPLICATE_PERCENTAGE for users,[]
