run_id,run_ts,dataset_name,table_name,check_name,dimension,issue_type,severity,affected_rows,affected_pct,sample_bad_rows_json,probable_root_cause,recommended_fix,root_cause_candidates
a35137bb-2eae-5be7-aa5c-c7e14f2ac7eb,2026-04-27T06:28:41.782728+00:00,phase1,users,users_email_not_null,completeness,missing,3,1,0.125,"[{""user_id"": ""9013d075-ddff-595a-adf2-e9c9eccfd6a6"", ""email"": null, ""org_id"": ""b2a2d6ab-38e5-5ca2-b36f-8efa55553fbf"", ""role"": ""student"", ""state"": ""CA"", ""district_id"": ""3c3be546-3856-5d03-8a9a-3a556e250810""}]",CRM export allows blank email when contact is incomplete,Add validation on source and require email before export,"[{""probable_cause"": ""CRM export allows blank email when contact is incomplete"", ""recommended_fix"": ""Add validation on source and require email before export""}]"
a35137bb-2eae-5be7-aa5c-c7e14f2ac7eb,2026-04-27T06:28:41.782728+00:00,phase1,users,users_district_id_not_null,completeness,missing,2,1,0.125,"[{""user_id"": ""ca48d9b7-02ce-55b9-bd75-2bb19c0aadac"", ""email"": ""eve.lem@example.com"", ""org_id"": ""9ebfa98f-e247-53a9-b5a2-605199e04030"", ""role"": ""other"", ""state"": ""CA"", ""district_id"": null}]",Upstream export omitted district join,Add district_id to export template and enforce ingestion join,"[{""probable_cause"": ""Upstream export omitted district join"", ""recommended_fix"": ""Add district_id to export template and enforce ingestion join""}]"
a35137bb-2eae-5be7-aa5c-c7e14f2ac7eb,2026-04-27T06:28:41.782728+00:00,phase1,users,users_email_unique,uniqueness,duplicate,4,1,0.125,"[{""user_id"": ""2700a5ef-71cc-53c5-96e2-d05385de9b01"", ""email"": ""alice.smith@example.com"", ""org_id"": ""d435273e-0707-52b0-8dad-3788f788c56e"", ""role"": ""teacher"", ""state"": ""CA"", ""district_id"": ""3c3be546-3856-5d03-8a9a-3a556e250810"", ""dq_rank"": ""2""}]",Email should uniquely identify CRM records.,Enforce DUPLICATE_PERCENTAGE for users,[]
a35137bb-2eae-5be7-aa5c-c7e14f2ac7eb,2026-04-27T06:28:41.782728+00:00,phase1,resources,resources_resource_id_unique,uniqueness,duplicate,4,1,0.16666666666666666,"[{""resource_id"": ""02ef9bac-27a1-5f7d-a01f-ab5f45da3c7d"", ""type"": ""lesson"", ""subject"": ""Math"", ""grade_band"": ""PreK-2"", ""dq_rank"": ""2""}]",Resource IDs must stay unique inside the catalog.,Enforce DUPLICATE_PERCENTAGE for resources,[]
a35137bb-2eae-5be7-aa5c-c7e14f2ac7eb,2026-04-27T06:28:41.782728+00:00,phase1,users,users_email_org_unique,uniqueness,duplicate,3,1,0.125,"[{""user_id"": ""2700a5ef-71cc-53c5-96e2-d05385de9b01"", ""email"": ""alice.smith@example.com"", ""org_id"": ""d435273e-0707-52b0-8dad-3788f788c56e"", ""role"": ""teacher"", ""state"": ""CA"", ""district_id"": ""3c3be546-3856-5d03-8a9a-3a556e250810"", ""dq_rank"": ""2""}]","The (email, org) compound key should dedupe duplicates.",Enforce DUPLICATE_PERCENTAGE for users,[]
