run_id,run_ts,dataset_name,table_name,check_name,dimension,issue_type,severity,affected_rows,affected_pct,sample_bad_rows_json,probable_root_cause,recommended_fix,root_cause_candidates
6aca77b5-7852-5681-ac76-b98bdb5a137e,2026-03-26T05:42:24.169705+00:00,phase1,users,users_email_not_null,completeness,missing,3,1,0.125,"[{""user_id"": ""f1edfb38-7ca9-50dc-8aa2-7e35318a4e62"", ""email"": null, ""org_id"": ""f0e96218-52a6-5008-a387-754e80b76e9e"", ""role"": ""student"", ""state"": ""CA"", ""district_id"": ""65935dbf-ce54-5345-a0d8-e66e2c6f74ec""}]",CRM export allows blank email when contact is incomplete,Add validation on source and require email before export,"[{""probable_cause"": ""CRM export allows blank email when contact is incomplete"", ""recommended_fix"": ""Add validation on source and require email before export""}]"
6aca77b5-7852-5681-ac76-b98bdb5a137e,2026-03-26T05:42:24.169705+00:00,phase1,users,users_district_id_not_null,completeness,missing,2,1,0.125,"[{""user_id"": ""ab068a7a-067a-5aa7-84bf-14ce2b452d20"", ""email"": ""eve.lem@example.com"", ""org_id"": ""5a0032a9-cdef-570b-95cd-9d9cbcd9ac9b"", ""role"": ""other"", ""state"": ""CA"", ""district_id"": null}]",Upstream export omitted district join,Add district_id to export template and enforce ingestion join,"[{""probable_cause"": ""Upstream export omitted district join"", ""recommended_fix"": ""Add district_id to export template and enforce ingestion join""}]"
6aca77b5-7852-5681-ac76-b98bdb5a137e,2026-03-26T05:42:24.169705+00:00,phase1,users,users_email_unique,uniqueness,duplicate,4,1,0.125,"[{""user_id"": ""ec40c2aa-c3ae-5afc-a02b-e96b8100c4fc"", ""email"": ""alice.smith@example.com"", ""org_id"": ""6c507437-3736-5467-8a78-7b7e48a9ca4e"", ""role"": ""teacher"", ""state"": ""CA"", ""district_id"": ""65935dbf-ce54-5345-a0d8-e66e2c6f74ec"", ""dq_rank"": ""2""}]",Email should uniquely identify CRM records.,Enforce DUPLICATE_PERCENTAGE for users,[]
6aca77b5-7852-5681-ac76-b98bdb5a137e,2026-03-26T05:42:24.169705+00:00,phase1,resources,resources_resource_id_unique,uniqueness,duplicate,4,1,0.16666666666666666,"[{""resource_id"": ""d1b5cc39-6578-5711-84b5-5ee181fd9d56"", ""type"": ""lesson"", ""subject"": ""Math"", ""grade_band"": ""PreK-2"", ""dq_rank"": ""2""}]",Resource IDs must stay unique inside the catalog.,Enforce DUPLICATE_PERCENTAGE for resources,[]
6aca77b5-7852-5681-ac76-b98bdb5a137e,2026-03-26T05:42:24.169705+00:00,phase1,users,users_email_org_unique,uniqueness,duplicate,3,1,0.125,"[{""user_id"": ""ec40c2aa-c3ae-5afc-a02b-e96b8100c4fc"", ""email"": ""alice.smith@example.com"", ""org_id"": ""6c507437-3736-5467-8a78-7b7e48a9ca4e"", ""role"": ""teacher"", ""state"": ""CA"", ""district_id"": ""65935dbf-ce54-5345-a0d8-e66e2c6f74ec"", ""dq_rank"": ""2""}]","The (email, org) compound key should dedupe duplicates.",Enforce DUPLICATE_PERCENTAGE for users,[]
